{
  "$schema": "http://json-schema.org/draft-07/schema#",
  "title": "Reproduction comparison record",
  "description": "On-disk machine-readable comparison written by reproduction-executor to <attempt_dir>/comparisons/comparison.json (agent definition v1.1, workflow step 4). One record per locked target id from the approved plan — no more, no fewer (pipeline invariant 3); scripts/reproduction-lane.py check-attempt enforces the one-to-one match and recomputes coverage from the outcomes. Outcome categories are the verdicts-and-precision v1.0 discrepancy classification plus PAPER_ERROR (its paper-error handling rule). Coverage numerator per coverage-rules v1.0: targets reproduced exactly or within pre-stated tolerance = EXACT_MATCH, WITHIN_PRECISION, WITHIN_CONFIDENCE. v1.1 (2026-10-05, gate 1.3 §5) adds per-target output citations: for an attempt run through run-container, each target cites the sealed run outputs it was read from, and a reproduced target that cites none is not admitted until ruled. v1.2 (2026-10-12, the gate 1.3 final review's F4) adds a per-target declaration of whether the comparison followed the approved plan's method and tolerance (method_as_planned), with the deviation described when it did not; a declared deviation is a flag for a human ruling.",
  "version": "1.2",
  "type": "object",
  "required": [
    "schema_version",
    "paper_slug",
    "attempt",
    "plan_sha256",
    "verdict",
    "targets"
  ],
  "additionalProperties": false,
  "properties": {
    "schema_version": {
      "enum": [
        "1.0",
        "1.1"
      ]
    },
    "paper_slug": {
      "type": "string",
      "minLength": 1
    },
    "attempt": {
      "type": "integer",
      "minimum": 1
    },
    "plan_sha256": {
      "type": "string",
      "pattern": "^[0-9a-f]{64}$",
      "description": "sha256 of the approved reproduction-plan.json this comparison scores against"
    },
    "verdict": {
      "type": "string",
      "enum": [
        "SUCCESSFUL",
        "PARTIAL",
        "FAILED",
        "BLOCKED"
      ]
    },
    "verdict_rationale": {
      "type": "string"
    },
    "targets": {
      "type": "array",
      "items": {
        "type": "object",
        "required": [
          "target_id",
          "outcome",
          "testable",
          "values_compared",
          "values_matched",
          "evidence"
        ],
        "additionalProperties": false,
        "properties": {
          "target_id": {
            "type": "string",
            "pattern": "^T[0-9]{2,3}$"
          },
          "outcome": {
            "type": "string",
            "enum": [
              "EXACT_MATCH",
              "WITHIN_PRECISION",
              "WITHIN_CONFIDENCE",
              "MINOR_DISCREPANCY",
              "MAJOR_DISCREPANCY",
              "CANNOT_COMPARE",
              "PAPER_ERROR"
            ]
          },
          "testable": {
            "type": "boolean",
            "description": "False when the target could not be tested (missing data, unbuildable environment); untestable targets stay in the denominator"
          },
          "failure_mode": {
            "type": [
              "string",
              "null"
            ],
            "description": "Required in substance when testable is false or the outcome is CANNOT_COMPARE"
          },
          "values_compared": {
            "type": "integer",
            "minimum": 0
          },
          "values_matched": {
            "type": "integer",
            "minimum": 0
          },
          "max_abs_difference": {
            "type": [
              "number",
              "null"
            ]
          },
          "evidence": {
            "type": "string",
            "minLength": 1,
            "description": "Path (relative to the attempt directory) of the value-level detail file, or the comparison procedure for visual targets"
          },
          "notes": {
            "type": "string"
          },
          "outputs": {
            "type": "array",
            "description": "v1.1: the sealed run outputs this target's values were read from. run is a credited run (the final run or one it consumed); path is relative to outputs/<run>/ as that run's outputs.json lists it (files/<work-copy path>, or stdout.log for printed results); sha256 must equal the sealed digest; lines optionally narrows a text output to a line range",
            "items": {
              "type": "object",
              "required": [
                "run",
                "path",
                "sha256"
              ],
              "additionalProperties": false,
              "properties": {
                "run": {
                  "type": "string",
                  "pattern": "^run-[0-9]{2,}$"
                },
                "path": {
                  "type": "string",
                  "minLength": 1
                },
                "sha256": {
                  "type": "string",
                  "pattern": "^[0-9a-f]{64}$"
                },
                "lines": {
                  "type": "string",
                  "pattern": "^[0-9]+(-[0-9]+)?$"
                }
              }
            }
          },
          "method_as_planned": {
            "type": "boolean",
            "description": "True when the comparison followed the approved plan's comparison_method and tolerance for this target; false when it departed from them, for any reason, including a change made after seeing the published value."
          },
          "method_deviation": {
            "type": [
              "string",
              "null"
            ],
            "description": "When method_as_planned is false: what changed from the plan, when, and why, and whether the planned method's own result is reported too."
          }
        }
      }
    },
    "coverage": {
      "type": "object",
      "additionalProperties": false,
      "properties": {
        "targets_enumerated": {
          "type": "integer",
          "minimum": 0
        },
        "targets_reproduced": {
          "type": "integer",
          "minimum": 0
        },
        "coverage_fraction": {
          "type": "number",
          "minimum": 0,
          "maximum": 1
        }
      }
    },
    "escalations": {
      "type": "array",
      "description": "PAPER_ERROR and CANNOT_COMPARE calls surface for human confirmation before entering study data (modernisation plan §4.4)",
      "items": {
        "type": "object",
        "required": [
          "kind",
          "detail"
        ],
        "additionalProperties": false,
        "properties": {
          "kind": {
            "type": "string",
            "enum": [
              "PAPER_ERROR",
              "CANNOT_COMPARE",
              "OTHER"
            ]
          },
          "target_id": {
            "type": [
              "string",
              "null"
            ]
          },
          "detail": {
            "type": "string",
            "minLength": 1
          }
        }
      }
    }
  }
}
